"id","year","title","editor","url","tags","cover","isbn","numberOfPages","description","pdf","worldcat","publisher","exhibition"
"16420","1963","Destruktion af RSG-6: en kollektiv manifestation af Situationistisk Internationale","","https://monoskop.org/log/?p=16420","nuclear weapons, painting, situationists","https://monoskop.org/images/3/32/Destruktion_af_RSG-6_En_kollektiv_manifestation_af_Situationistisk_Internationale_1963.jpg","","26","The name of the exhibition is an homage to Spies for Peace’s Official Secret – RSG6 action, in which the anti-war activist group revealed that, in the event of a nuclear attack, the British government had conceived a plan to house key central government personnel in a secret bunker known as Regional Seat of Government number 6 (RSG-6). The intent was to insure continuity of law and order in the event of a nuclear holocaust. The information was published in the _Danger! Official Secret RSG-6_ pamphlet, of which 4,000 copies were produced, then mailed to key officials and distributed on the streets.\n\nThe catalogue includes photographic portraits of Guy Debord, Michele Bernstein, J.V Martin and Jan Strijbosch, as well as reproduction of original artwork by these members of the S.I. It also serves as the first edition of Guy Debord’s important text ‘Les Situationnistes ou les nouvelles formes d’action dans la politique ou l’art’, published in the original French as well as in Danish and English translations.\n\nFeatured pieces – all the result of some form of detournement – include Debord’s “Directives”, Bernstein’s “Victories”, and J.V. Martin’s “Thermonuclear maps” (paintings representing various regions of the globe during World War III), among others. All the artwork is shown in a gallery setting that invokes a post-nuclear world – one area, for instance, was a reconstruction of an oppressive nuclear bomb shelter.\n\nThis catalog is particularly scarce because most copies (and, in a rather ironic twist of the fate, the bulk of the artwork shown at EXI) were destroyed by a fire bomb on 18 March 1965.","https://monoskop.org/images/7/73/Destruktion_af_RSG-6_En_kollektiv_manifestation_af_Situationistisk_Internationale_1963.pdf","","Galerie Exi, Odense, [1963]",""
"16409","2011","nul = 0: The Dutch Nul Group in an International Context","Colin Huizing and Tijs Visser","https://monoskop.org/log/?p=16409","art, art history, avant-garde, environment, gutai, kinetic art, nouveau realisme, sculpture, zero","http://ecx.images-amazon.com/images/I/51fJcvBRuML.jpg","9789056628383","192","The legendary art collective Nul was founded in Amsterdam in 1961. Its members–Armando, Jan Henderikse, Henk Peeters, Jan Schoonhoven and (briefly) herman de vries–revolutionized Dutch art, allying themselves with the German Zero group, the French Nouveau Réalistes and the Japanese , as well as with artists such as Yves Klein and Lucio Fontana. Alongside these groups, Nul set the tone for the climate of the European avant-garde in the 1960s. The group collaborated on manifestos, happenings and publications, and individually produced serial, minimalist sculptures, installations and assemblages, which they exhibited collectively. _Nul = 0_ accompanies the Stedelijk Museum’s 2011 survey of the movement, offering extensive historical analysis through interviews, essays, archival photographs and an illustrated chronology. Featuring a die-cut cover (with two concentric zeroes), it constitutes a definitive overview of Nul’s activities, its kindred spirits and its legacy.","http://www.4321zero.com/uploads/2/4/0/7/24071735/nulinternational.pdf","http://worldcat.org/oclc/792988372","Stedelijk Museum, Schiedam, and NAi Publishers, Rotterdam, 2011","http://www.stedelijkmuseumschiedam.nl/en/exhibitions/archive/227-nul-0-nederlandse-avant-garde-in-een-internationale-context-1961-1967-2"
"16406","1982","The Neoist Network’s First European Training Camp","Kryptic Press [Peter Below], Würzburg, and Centre de recherche Neoiste [Istvan Kantor], Montreal, 1982","https://monoskop.org/log/?p=16406","neoism","https://monoskop.org/images/f/fe/The_Neoist_Networks_First_European_Training_Camp_1982.jpg","","","","https://monoskop.org/images/8/88/The_Neoist_Networks_First_European_Training_Camp_1982.pdf","","",""
"16402","2015","Vanja Malloy (ed.): Intersecting Colors: Josef Albers and His Contemporaries","","https://monoskop.org/log/?p=16402","art, art history, colour, theory","http://acpress.amherst.edu/books/intersectingcolors/wp-content/uploads/sites/11/2015/08/IntersectingColorsPBCover.jpg","","99","Josef Albers (1888–1976) was an artist, teacher, and seminal thinker on the perception of color. A member of the Bauhaus who fled to the U.S. in 1933, his ideas about how the mind understands color influenced generations of students, inspired countless artists, and anticipated the findings of neuroscience in the latter half of the twentieth century.\n\nWith contributions from the disciplines of art history, the intellectual and cultural significance of Gestalt psychology, and neuroscience, Intersecting Colors offers a timely reappraisal of the immense impact of Albers’s thinking, writing, teaching, and art on generations of students. It shows the formative influence on his work of non-scientific approaches to color (notably the work of Johann Wolfgang von Goethe) and the emergence of Gestalt psychology in the first decades of the twentieth century. The work also shows how much of Albers’s approach to color—dismissed in its day by a scientific approach to the study and taxonomy of color driven chiefly by industrial and commercial interests—ultimately anticipated what neuroscience now reveals about how we perceive this most fundamental element of our visual experience.","http://acpress.amherst.edu/assets/IntersectingColorsIA.pdf","http://worldcat.org/oclc/919171074","Amherst College Press, Amherst, MA, Sep 2015","http://www.amherst.edu/museums/mead/exhibitions/2015/intersecting-colors-josef-albers-and-his-contemporaries"
"16339","2009","Waste Not: Zhao Xiangyuan & Song Dong","Wu Hung","https://monoskop.org/log/?p=16339","art, china, contemporary art, waste","http://www.aaa.org.hk/mediaImage/CE2F75C-E286-4084-ABB8-82006EA51.jpg","9784904149027","188","_Waste Not_ is an exhibit by Chinese artist Song Dong that displays over 10,000 domestic objects formerly owned by his late mother, who refused to throw anything away if she could possibly reuse it. She had suffered poverty during China’s turmoils in the 1950s and 1960s and had acquired a habit of thrift and re-use that led her to store domestic objects of all kinds in her tiny house in Beijing. After the death of her husband in 2002, her desire to hoard items became an obsession that began to have an impact on her standard of living. Song and his sister managed to alleviate it by persuading her to let him use her possessions as an art installation, reflecting her life and the modern history of China as experienced by one family. First exhibited in Beijing in 2005, _Waste Not_ has since travelled around the world to major galleries in Canada, the United Kingdom and the United States, where it has been well received by critics.","http://lucian.uchicago.edu/blogs/wuhung/files/2012/12/Waste-Not.pdf","http://worldcat.org/oclc/695538201","Tokyo Gallery, Tokyo, and Beijing Tokyo Art Projects, Beijing, 2009",""
"16336","1999","Wu Hung: Transience: Chinese Experimental Art at the End of the Twentieth Century","","https://monoskop.org/log/?p=16336","1980s, 1990s, art, art history, china, contemporary art","http://images.amazon.com/images/P/0935573275.01.LZZZZZZZ.jpg","","214","In a novel approach to avant-garde Chinese art, the 1999 exhibition _Transience_ established a historical framework for current artistic production in China. Organized by the David and Alfred Smart Museum of Art at the University of Chicago, the show and its catalog highlighted the diverse responses of twenty-two artists to China’s recent history and current social transformation.\n\nWritten by Wu Hung, a leading authority and the curator of the exhibit, _Transience_ explores contemporary Chinese art through the themes of demystification, ruins, and transience, and represents an original perspective in the continuing discussion on Chinese experimental art.","http://lucian.uchicago.edu/blogs/wuhung/files/2012/12/TRANSIENCE_whole-book.pdf","http://worldcat.org/oclc/41271947","David and Alfred Smart Museum of Art, University of Chicago, 1999",""
"16331","1993","China’s New Art, Post-1989, with a Retrospective from 1979-1989","Valerie C. Doran","https://monoskop.org/log/?p=16331","1980s, 1990s, art, china, contemporary art, painting, sculpture","https://monoskop.org/images/8/87/Chinas_New_Art_Post-1989.jpg","","232","This is the catalogue for the seminal exhibition _China’s New Art Post-1989_, the first major collection of Chinese experimental art to be exhibited outside of the country. It was first held in Hong Kong in 1993 and subsequently travelled to Australia and the United States.\n\nThe present catalogue offers an in-depth study of the various artistic undercurrents and general cultural sensibilities for the creation of experimental art in China during the late 1980s and the early 1990s, through 17 essays from a number of noted critics and art historians. The artists are placed and studied under various categories, namely ‘Political Pop’ (pp 1-65), ‘Cynical Realism: Irreverence and Malaise’ (67-103), ‘The Wounded Romantic Spirit’ (105-141), ‘Emotional Bondage: Fetishism and Sado-Masochism’ (143-185), ‘Ritual and Purgation: Endgame Art’ (187-201), and ‘Introspection and Retreat into Formalism: New Abstract Art’ (203-233).\n\nAs Chang Tsongzung, one of the curators of the exhibition, writes, ‘The art of the Post-1989 period was significant as it characterised the spirit of the new decade, closing the chapter of the 1980s. It was important also for the fact that it presented to the world the first major coherent overview of China’s experimental art scene, and has maintained a continuing dialogue ever since.'","http://ebook.lib.hku.hk/HKG/B35838267.pdf","http://worldcat.org/oclc/311726534","Hanart T Z Gallery, Hong Kong, 1993",""
"16303","2015","Anders Kreuger (ed.): The Welfare State","","https://monoskop.org/log/?p=16303","art, labour, politics, welfare state","https://monoskop.org/images/a/a1/Kreuger_Anders_ed_The_Welfare_State.jpg","9789072828521","139","The welfare state is an abstract notion. But also very concrete. Political, but also bureaucratic. What does it have to do with art?\n\nThe welfare state operates with regulations, rights and obligations that apply to everyone in the same way, requiring individuals to identify themselves as members of society first and foremost. In this sense, the welfare state is the antithesis of art. Many artists support the welfare state in both theory and practice, and they are fascinated by rules as such, but they have little interest in following rules formulated by others than themselves..\n\nThe welfare state is an emancipatory political project, although it was first invented as a way of keeping class struggle and revolution at bay. It is hard to disassociate the European welfare state from the darker elements of recent history, such as militarism, colonialism and the degradation of the natural environment. Yet the welfare state, as a model for social cohesion and political stability, is now gaining ground in new parts of the world, notably in East Asia.\n\nThe exhibition _The Welfare State_ does not look back with nostalgia at the welfare state in its ‘classical’ form as a utopian blueprint for an egalitarian (and homogenous) society in postwar Western Europe. It does not invite artists to ‘illustrate’ political and social engagement. But it does ask some fundamental questions. What is the ‘imaginary’ of the welfare state? Does it have a ‘form’? Can it be ‘shown’?","https://monoskop.org/images/0/08/Kreuger_Anders_ed_The_Welfare_State_2015.pdf","","M HKA, Antwerp, 2015","http://muhka-welfarestate.org/"
"16296","2009","Unica Zürn: Dark Spring","","https://monoskop.org/log/?p=16296","art, surrealism","http://image.issuu.com/121219182030-f3b8494b15cf4270a69fd0183c79a629/jpg/page_1.jpg","9780942324396","93","_Unica Zürn: Dark Spring_ presents ink and watercolor works on paper by the late German artist and writer Unica Zürn, spanning from the early 1950s until her suicide in 1970. A noted poet and novelist, Zürn produced numerous expressionistic short stories that were published in German newspapers throughout the 1950s before moving to Paris with German Surrealist artist, Hans Bellmer, who would be her partner and collaborator until her death. Zürn began producing paintings and drawings related to her Surrealist-influenced literary work while living in Paris, becoming acquainted with many artists in the Surrealist circle, including André Breton, Max Ernst, Man Ray, and Marcel Duchamp. Part whimsical cartoons, part intricate portraits, Zürn’s chimerical fantasies make for drawings that are deeply revelatory yet playfully imaginative.","https://monoskop.org/images/3/3a/Zurn_Unica_Dark_Spring.pdf","","The Drawing Center, New York, 2009",""
"16292","2006","Eva Hesse: Circles and Grids","","https://monoskop.org/log/?p=16292","art, drawing","http://image.issuu.com/100825195127-f8215dd185a545529c363017820e2740/jpg/page_1.jpg","","16","","https://monoskop.org/images/c/c9/Hesse_Eva_Circles_and_Grids.pdf","","The Drawing Center, New York, 2006",""
"16268","1999","Another City for Another Life: Constant’s New Babylon","","https://monoskop.org/log/?p=16268","architecture, situationists","https://monoskop.org/images/9/94/Another_City_for_Another_Life_Constants_New_Babylon.jpg","","34","the first major U.S. presentation of the work of Constant and his New Babylon project. The exhibition was organized for The Drawing Center by Mark Wigley, based on the retrospective he curated for the Witte de With in Rotterdam in 1998. _Another City for Another Life_ focuses on Constant’s tremendous contribution to visionary architecture through the practice of drawing and offered an in-depth consideration of the artist’s futuristic project.","","","The Drawing Center, New York, 1999",""
"16264","2014","Xanti Schawinsky: Head Drawings and Faces of War","","https://monoskop.org/log/?p=16264","art, bauhaus, drawing, war","http://image.issuu.com/140904203424-6ba313748925aafe234b5703b8bd3199/jpg/page_1.jpg","9780942324891","120","a look at first generation Bauhaus artist Alexander ‘Xanti’ Schawinsky’s oeuvre, which encompasses a range of social and political investigations. Schawinsky played a key role in the school’s vital social life and was a member of the Bauhaus Band. He studied graphic design and experimental photography and was also deeply engaged in the Bauhaus’s theater workshop as an actor, set and costume designer, creator of performances, and teacher.\n\nThe exhibition catalogue focuses on two bodies of work Schawinsky made between 1941 and 1946, _Faces of War_ and the _Head Drawings_. The former are man-machine hybrids that could represent either an aggressive enemy or a powerful avenger—or perhaps an identity that encompasses both. The _Faces of War_ break from the utopian optimism of the early Bauhaus and reveal the existential struggle of an artist coping with identity and the devastation of war. The _Head Drawings_ allowed Schawinsky to literally remake his own “portrait” out of such detritus of the natural world as thread, crystals, rope, and rocks.","https://monoskop.org/images/5/5f/Schawinsky_Xanti_Head_Drawings_and_Faces_of_War.pdf","","The Drawing Center, New York, 2014",""
"16132","1977","The Record as Artwork: From Futurism to Conceptual Art","Germano Celant","https://monoskop.org/log/?p=16132","art, avant-garde, conceptual art, dada, fluxus, futurism, music, sound art","https://monoskop.org/images/8/84/The_Record_as_Artwork_From_Futurism_to_Conceptual_Art_1977.jpg","","121","","https://monoskop.org/images/d/dc/The_Record_as_Artwork_From_Futurism_to_Conceptual_Art_1977.pdf","http://worldcat.org/oclc/4005125","Museum of Contemporary Art, Chicago, 1977",""
"16127","1967","Takis: Magnetic Sculpture","","https://monoskop.org/log/?p=16127","art, electromagnetism, sculpture","https://monoskop.org/images/1/10/Takis_Magnetic_Sculpture_1967.jpg","","","","https://monoskop.org/images/8/8d/Takis_Magnetic_Sculpture_1967.pdf","http://worldcat.org/oclc/5066727","Howard Wise Gallery, New York, 1967",""
"16116","1949","Compagnie de l’Art Brut: L’art brut préféré aux arts culturels","","https://monoskop.org/log/?p=16116","art, art brut, folk art, naive art, outsider art","https://monoskop.org/images/1/1e/Compagnie_de_l_Art_Brut_L_art_brut_prefere_aux_arts_culturels_1949.jpg","","","Jean Dubuffet’s strong anti-cultural positions have led him to be interested and to seek new forms of art, far from any official production. The term Art Brut appears in 1945, when Jean Dubuffet made his first trips to research marginal art work in Switzerland and in France. Two years later, the art dealer René Drouin makes available the basement of his gallery, Place Vendôme in Paris, which became the _Foyer de l’Art Brut_. Inaugurated with the Barbus Müller, it welcomed exhibitions devoted to Wölfli, Crépin, Aloïse, Salingardes, Forestier, Juva and Hernandez.\n\nIn autumn of 1948, the _Foyer de_ l’_Art Brut_ is transfered to a house rented by the editor Gaston Gallimard and became the _Compagnie de l’Art Brut_. The founding members included , André Breton, Jean Paulhan, Charles Ratton, Henri-Pierre Roché, Michel Tapié and Edmond Bomsel. The artist Slavko Kopač assumed the role of curator of the collection.\n\nIn October 1949, the Galerie René Drouin exhibits 200 works by 60 different authors. The text of the catalogue, entitled _L’Art Brut préféré aux arts culturels_ \[Crude Art Preferred to Cultural Art\], written by Jean Dubuffet, defines the concept of Art Brut:\n\n‘By this we mean the works executed by people free artistic culture, where mimicry, contrary to what happens among intellectuals, has little or no part, so that their authors draw all (subjects, choice of the used materials, means of transposition, rhythms, ways of writing, etc.) of their own heart and not clichés of classical art or fashionable art. We assist them in all pure artistic operation, raw, reinvented in the whole of all its phases by its author, from only his own impulses. Art so that the only function of the invention is manifested, and not those, constants in cultural art, chameleon and monkey.'","https://monoskop.org/images/b/b1/Compagnie_de_l_Art_Brut_L_art_brut_prefere_aux_arts_culturels_1949.pdf","","René Drouin, Paris, October 1949",""
"16023","1966","G.R. Swenson: The Other Tradition","","https://monoskop.org/log/?p=16023","art, art history, pop art, surrealism","https://monoskop.org/images/3/37/The_Other_Tradition_1966.jpg","","40","The exhibition was conceived in opposition to the then-dominant mode of formalist analysis and critique, and its aim was no less than “to document the need for a new critical and scholarly approach to twentieth century art.” It presented works, primarily paintings, by thirty-six artists plus a copy of Alfred Stieglitz’s magazine with a Dada montage by Francis Picabia on the cover. The collective proposition, a radical one for the times, was that the pathway to Pop Art led inexorably through Surrealism, which this exhibition also sought to cast in a different light.\n\nOrganized by New York art critic Gene Swenson (1934-69), the exhibition was accompanied by a modest catalogue whose passionate, forty-page essay dismantles Cubism’s claims to formalist innovation. Surrealism is shown to be much cooler (making dreams concrete) and Pop much hotter (making feelings into things) than typically held—and also much more effective. Art’s job is, Swenson wrote, “to turn feelings into things so we that can deal with them.”","https://monoskop.org/images/4/40/The_Other_Tradition_1966.pdf","","Institute of Contemporary Art, University of Pennsylvania, Philadelphia, 1966",""
"16006","1991","Vlasta Čiháková-Noshiro (ed.): Umění akce","","https://monoskop.org/log/?p=16006","1960s, 1970s, 1980s, action art, art, czechoslovakia, happening, performance art","https://monoskop.org/images/c/c8/Cihakova-Noshiro_Vlasta_ed_Umeni_akce_1991.jpg","","","","https://monoskop.org/images/b/b6/Cihakova-Noshiro_Vlasta_ed_Umeni_akce_1991.pdf","","Mánes, Prague, 1991",""
"15954","2000","Gordon Matta-Clark, Carol Goodden, Tina Girouard: Food","","https://monoskop.org/log/?p=15954","art, food","https://monoskop.org/images/9/9c/Matta-Clark_Goodden_Girouard_Food_2000.jpg","","48","For a long time, one or another artist, frequently Gordon, cooked up a storm and served it for dinner. There was no choice of what to eat. Some of the food was extremely creative. Although it was not exactly the same thing as 112, most of the same people cooked and ate there and in a sense it was a spin-off of the space around the corner. Of course it has been thought that _Food_ would make money but on the contrary it only lost it.” Caroline Goodden\n\n“We spread money to the whole art world. I worked at Food two and a half to three days a week. One day a week each person was boss. There was lots of Cajun and Creole cuisine, mostly from Louisiana. A lot of the food came from Phil Glass’ group, the vegetarian group; the dancers, Rachel Lew and Suzy Harris. The space was designed so that the audience–the customers–could watch everything. Food became the vehicle for people to be introduced to the art world.” Tina Girouard\n\n“In honor of _Food_, this publication is presented in the form of a restaurant menu, and documents the artist’s varied and imaginative work, including sculptures, film stills, and photos.","https://monoskop.org/images/f/f2/Matta-Clark_Goodden_Girouard_Food_2000.pdf","http://worldcat.org/oclc/45439448","Walther König, Cologne, and Cornerhouse, Manchester, 2000","http://gallery400.uic.edu/exhibitions/food"
"15399","2010","Bas Jan Ader: Suspended Between Laughter and Tears","Kira Poplowski","https://monoskop.org/log/?p=15399","art","http://pitweb.pitzer.edu/galleries/wp-content/uploads/sites/77/2010/09/2010-jan-bas-ader-1024x713.jpg","9780982995600","69","Ader’s work centers on short-duration acts of physical and emotional release. In the noted film and subsequent photographs titled _I’m Too Sad to Tell You_ (1971), the artist is seen crying directly into the camera amplifying a simple human emotion – grief – into a profound and revelatory experience. Ader also makes use of the force of gravity as a medium in his performance work, as documented in film and photography. His videos, in many respects, bear an explicit physicality, which are the hallmark of many silent films. Other projects, including the unfinished trilogy _In Search of the Miraculous_ (1975), during which the artist disappeared, stretch the boundaries of sentimentalism through existential journey.\n\nAder frequently referenced Dutch artistic and cultural traditions in his work. Photographs such as On the road to a new _Neo Plasticism, Westkapelle, Holland_ (1971) reveal his interest in Mondrian and the De Stijl movement, which sought simplified compositions to express a utopian harmony. Dutch landscape and still life painting traditions can be seen in videos such as _Primary Time_ (1974), in which he arranges and rearranges a red, blue and yellow bouquet of flowers, and in photographs like _Farewell to Faraway Friends_ (1971), where the artist casts himself as a romantic wanderer – linking himself to the paintings of 19th century German artist Caspar David Friedrich – but ultimately setting the tone for his physical acts of searching.","http://pitweb.pitzer.edu/galleries/wp-content/uploads/sites/77/2010/09/2010_Catalogue-BasJanAder.pdf","","Pitzer College, 2010",""
