"id","year","title","editor","url","tags","cover","isbn","numberOfPages","description","pdf","worldcat","publisher","exhibition"
"19463","1991","InterCommunication ’91: The Museum Inside the Telephone Network","Urban Design Research","https://monoskop.org/log/?p=19463","art, communication, computer art, computer graphics, fax, interactive art, media art, sound art, telephone","https://monoskop.org/images/2/21/InterCommunication_91_The_Museum_Inside_the_Telephone_Network_1991.jpg","","259","invisible” museum. Later it was followed up by another ICC exhibition _The Museum Inside the Network_ (1995). The ICC opened its exhibition space in 1997.\n\nThe works and messages from almost 100 artists, writers, and cultural figures were available through five channels. The works in “Voice & sound channel” such as talks and readings on the theme of communication could be listened to by telephone. The “Interactive channel” offered participants to create musical tunes by pushing buttons on a telephone. Works of art, novels, comics and essays could be received at home through “Fax channel”. The “Live channel","https://monoskop.org/images/8/81/InterCommunication_91_The_Museum_Inside_the_Telephone_Network_1991.pdf","http://worldcat.org/oclc/676249560","NTT, Tokyo, 1991","http://www.ntticc.or.jp/en/exhibitions/1991/intercommunication-91-the-museum-inside-the-telephone-network/"
"19415","2013","A Constellation of Stars: Huang Rui and Ma Desheng: Art Editors, 1978-1983","Iona Whittaker and Huang Rui","https://monoskop.org/log/?p=19415","1980s, china, drawing, printmaking, stars group","https://monoskop.org/images/5/5a/A_Constellation_of_Stars_Huang_Rui_and_Ma_Desheng_Art_Editors_1978-1983_2013.jpg","","212","","https://monoskop.org/images/3/32/A_Constellation_of_Stars_Huang_Rui_and_Ma_Desheng_Art_Editors_1978-1983_2013.pdf","","Hadrien de Montferrand Gallery, Beijing, 2013",""
"19408","1980","Für Augen und Ohren: von der Spieluhr zum akustischen Environment. Objekte, Installationen, Performances","René Block, Lorenz Dombois, Nele Hertling, and Barbara Volkmann","https://monoskop.org/log/?p=19408","electronic music, experimental music, music, music history, musical instruments, musique concrète, performance, sound, sound art","https://monoskop.org/images/3/3f/Fuer_Augen_und_Ohren_1980.jpg","","312","","https://monoskop.org/images/a/ae/Fuer_Augen_und_Ohren_1980.pdf","http://worldcat.org/oclc/992626777","Akademie der Künste, Berlin, 1980",""
"19369","1988","Coco Fusco: Young, British and Black: The Work of Sankofa and Black Audio Film Collective","","https://monoskop.org/log/?p=19369","black people, documentary film, film, postcolonialism, third cinema, video","https://monoskop.org/images/f/f7/Coco_Fusco_Young_British_and_Black_The_Work_of_Sankofa_and_Black_Audio_Film_Collective_1988.jpg","","65","Sankofa Film/Video Collective and Black Audio Film Collective are the most celebrated and controversial Black media groups to emerge from the British workshop movement of the 1980s. Their work focuses on the representation of the Black subject in mainstream and alternative media, also touching on such issues as institutionalized racism, sexual politics and national identity in postcolonial Britain. Challenging stylistic conventions of both documentary and fiction film, their work provides a basis for critical reflection on the history of Black film culture, Third Cinema, and their future directions.” (back cover)\n\nFeaturing essays “A Black Avant-Garde?” by Coco Fusco (originally published as “Black Filmmaking in Britain’s Workshop Sector” appearing in a 1988 issue of _Afterimage_ Vol 14, No 7); “An Interview with Martina Attille and Isaac Julien of Sankofa Film/Video Collective,” and “An Interview with Black Audio Film Collective: John Akomfrah, Lina Gopaul, Avril Johnson and Reece Auguiste,","https://monoskop.org/images/a/a1/Coco_Fusco_Young_British_and_Black_The_Work_of_Sankofa_and_Black_Audio_Film_Collective_1988.pdf","http://worldcat.org/oclc/950122377","Hallwalls, Contemporary Arts Center, Buffalo, NY, 1988",""
"19344","1982","Deborah Wye: Louise Bourgeois","","https://monoskop.org/log/?p=19344","art, sculpture","https://monoskop.org/images/f/f0/Wye_Deborah_Louise_Bourgeois_1982.jpg","","124","","https://monoskop.org/images/0/09/Wye_Deborah_Louise_Bourgeois_1982.pdf","http://worldcat.org/oclc/299383428","Museum of Modern Art, New York, 1982","https://www.moma.org/calendar/exhibitions/2243"
"19339","1988","Philip Johnson, Mark Wigley: Deconstructivist Architecture","","https://monoskop.org/log/?p=19339","architecture, constructivism, deconstruction, deconstructivism, history of architecture","https://monoskop.org/images/7/79/Johnson_Philip_Wigley_Mark_Deconstructivist_Architecture_1988.jpg","","104","This book presents a radical architecture, exemplified by the work of seven architects. Illustrated are projects for Santa Monica, Berlin, Rotterdam, Frankfurt, Hong Kong, Paris, Hamburg, and Vienna, by Frank O. Gehry, Daniel Libeskind, Rem Koolhaas, Peter Eisenman, Zaha M. Hadid, Bernard Tschumi, and the firm of Coop Himmelblau","","http://worldcat.org/oclc/18376913","Museum of Modern Art, New York, 1988","https://www.moma.org/calendar/exhibitions/1813"
"19194","2011","Beyond the Dust: Artists’ Documents Today","Roger Willems in collaboration with Gwenneth Boelens.","https://monoskop.org/log/?p=19194","archive, art, document","https://monoskop.org/images/b/b9/Beyond_the_Dust_Artists_Documents_Today_2011.jpg","9789077459560","209","","https://monoskop.org/images/9/93/Beyond_the_Dust_Artists_Documents_Today_2011.pdf","http://worldcat.org/oclc/931841383","Roma Publications, Amsterdam, 2011",""
"19104","2017","Ryszard Winiarski: Event, Information, Image","Ania Muszyńska and Magdalena Marczak-Cerońska","https://monoskop.org/log/?p=19104","conceptual art, mathematics, painting","https://monoskop.org/images/1/16/Ryszard_Winiarski.jpg","9788364381089","156","","https://monoskop.org/images/4/48/Ryszard_Winiarski_Event_Information_Image_2017.pdf","","Fundacja Rodziny Staraków, Warsaw, 2017",""
"19051","2014","Lebbeus Woods, Architect","","https://monoskop.org/log/?p=19051","architecture, drawing","https://monoskop.org/images/a/a5/Lebbeus_Woods_Architect_2014.jpg","9780942324846","129","Acknowledging the parallels between society’s physical and psychological constructions, architect Lebbeus Woods has depicted a career-long narrative of how these constructions transform our being. Working mostly, but not exclusively, with pencil on paper, Woods has created an oeuvre of complex worlds—at times abstract and at times explicit—that present shifts, cycles, repetitions within the built environment. His timeless architecture is not in a particular style or in response to a singular moment in the field; rather, it offers an opportunity to consider how built forms impact the individual and the collective, and reflect contemporary political, social and ideological conditions, and how one person contributes to the development and mutation of the built world.\n\n_Lebbeus Woods, Architect_ brings together works from the past forty years by one of the most influential designers working in architecture. Beyond architects, he has been hailed by designers, filmmakers, writers, and artists as a significant voice in recent history, his works resonate across many disciplines for their conceptual depth, imaginative breadth, lasting beauty and ethical potency. The catalogue centers on transformation as a recurring theme, providing a framework for understanding the experimental nature of the work.","https://monoskop.org/images/5/5b/Lebbeus_Woods_Architect_2014.pdf","http://worldcat.org/oclc/892036430","Drawing Center, New York, 2014","https://www.sfmoma.org/exhibition/lebbeus-woods-architect/"
"19036","2014","Len Lye: Motion Sketch","","https://monoskop.org/log/?p=19036","drawing, experimental film, motion, movement, photography","https://monoskop.org/images/4/42/Lye_Len_Motion_Sketch_2014.jpg","9780942324853","97","Len Lye’s career was marked by a lifelong fascination with movement and an aspiration to compose motion; the movement of the drawing hand was an important touchstone for his works in various media. In the 1920s, however, Lye began to make what he termed “motion sketches”; abstract drawings that attempted to render the movement of his subjects, rather than their appearance.\n\n_Motion Sketch_ reintroduces Lye’s multidimensional practice specifically in relation to drawing. Describing his drawing practice in his own carefree prose, Lye said that doodling “cultivates a vacuous seaweed-pod state of kelp as a skull which is attached to a pencil betwixt the arm and the fingers held doodling in turn ‘twixt you and the paper in a rather bemused, empty, harmonious state of an attitude, eyes periphering said paper.”\n\nLye’s kinesthetic approach to drawing—related to Surrealist automatism and anticipating aspects of Abstract Expressionism—also informed his practice in painting, photography, film and sculpture. Not limited to works on paper; the catalogue reveals how Lye’s concept of “doodling” underpinned his approach to much of his work.","https://monoskop.org/images/b/b9/Lye_Len_Motion_Sketch_2014.pdf","http://worldcat.org/oclc/892194766","Drawing Center, New York, 2014","http://www.drawingcenter.org/en/drawingcenter/5/exhibitions/9/upcoming/589/len-lye/"
"18953","2012","Benjamin Patterson: Born in the State of FLUX/us","Valerie Cassel Oliver","https://monoskop.org/log/?p=18953","action art, art, experimental music, fluxus, happening, music, performance, performance art, sound","https://monoskop.org/images/c/cb/Patterson_Benjamin_Born_in_the_State_of_FLUXus_2012.jpg","9781933619293","268","_Benjamin Patterson: Born in the State of FLUX/us_ is a retrospective of the artist’s career, which now spans nearly fifty years. The exhibition includes both early and recent work by the artist that range from annotated scores and books to painting and sculpture. Video documentation from performances and audio files of ’s music will also be featured. As a founding member of , a loose and international collective of artists who infused avant-garde practices of the day with humor and anarchic energy, Patterson helped revolutionize the artistic landscape at the advent of the 1960s and usher in an era of new and experimental music.","https://monoskop.org/images/0/0a/Patterson_Benjamin_Born_in_the_State_of_FLUXus_2012.pdf","http://worldcat.org/oclc/630503046","Contemporary Arts Museum, Houston, 2012.",""
"18888","2013","Parallel Practices: Joan Jonas & Gina Pane","Dean Daderko","https://monoskop.org/log/?p=18888","art, art criticism, performance, performance art, video, video art","https://monoskop.org/images/9/97/Parallel_Practices_Joan_Jonas_and_Gina_Pane_2013.jpg","9781933619439","160","_Parallel Practices: Joan Jonas & Gina Pane_ considers the works of two pioneers of performance art. Jonas (born 1936) and Pane (1939-1990) lived and worked in the United States and France respectively. Each artist worked multidisciplinarily, producing sculpture, drawings, installations, film and video in addition to live actions. Notably, Jonas and Pane have been lauded for their foundational work in performance, a field in which both of these artists blazed trails. Published to accompany an exhibition at the Contemporary Arts Museum Houston, _Parallel Practices_ explores the trajectory of these artists’ practices to reveal shared and complementary aspects, as well as to highlight the significant divergences and differences that characterize each artist’s work. It includes texts by curator Dean Daderko, Elisabeth Lebovici and Anne Tronche and Barbara Clausen.","https://monoskop.org/images/9/9d/Parallel_Practices_Joan_Jonas_and_Gina_Pane_2013.pdf","http://worldcat.org/oclc/900956555","Contemporary Arts Museum, Houston, 2013","http://camh.org/exhibitions/parallel-practices-joan-jonas-gina-pane"
"18885","1985","Robert Rauschenberg: Work From Four Series","","https://monoskop.org/log/?p=18885","art","https://monoskop.org/images/9/9c/Rauschenberg_Robert_Work_From_Four_Series_1985.jpg","","86","The relationships between four of Rauschenberg’s mature series—the _Kabal American Zephyrs_, _Cardboards_, _Hoarfrosts_ and _Bifocals_—are explored in this exhibition. The artist has always worked in series, but they are often seen as discrete directions, unrelated to one another. This exhibition and accompanying catalogue demonstrate that the artist returns to similar themes and uses the same formal devices across his seemingly disparate oeuvre.\n\nIncludes essays by Donald Barthelme and Linda L. Cathcart; a chronology of the period covered by the four series by Marti Mayo; and documentation on the artist’s career subsequent to his 1976 retrospective.","https://monoskop.org/images/b/b2/Rauschenberg_Robert_Work_From_Four_Series_1985.pdf","http://worldcat.org/oclc/13197442","Contemporary Arts Museum, Houston, 1985","http://camh.org/exhibitions/robert-rauschenberg-work-four-series-sesquicentennial-exhibition"
"18882","1981","Persona","","https://monoskop.org/log/?p=18882","anonymity, art, body art, narrative, performance, subjectivity","https://monoskop.org/images/9/98/Persona_1981.jpg","","57","","https://monoskop.org/images/7/7a/Persona_1981.pdf","http://worldcat.org/oclc/559306423","The New Museum, New York, 1981","http://archive.newmuseum.org/index.php/Detail/Occurrence/Show/occurrence_id/43"
"18874","2013","Radical Presence: Black Performance in Contemporary Art","Valerie Cassel Oliver","https://monoskop.org/log/?p=18874","art, art history, contemporary art, performance, performance art","https://monoskop.org/images/6/6b/Radical_Presence_Black_Performance_in_Contemporary_Art_2013.jpg","","144","","https://monoskop.org/images/5/59/Radical_Presence_Black_Performance_in_Contemporary_Art_2013.pdf","http://worldcat.org/oclc/864564353","Contemporary Arts Museum, Houston, 2013","http://camh.org/exhibitions/radical-presence-black-performance-contemporary-art"
"18835","1980","A Sound Selection: Audio Works by Artists","Barry Rosen","https://monoskop.org/log/?p=18835","sound art","https://monoskop.org/images/8/87/A_Sound_Selection_Audio_Works_by_Artists_1980.jpg","","","","https://monoskop.org/images/6/61/A_Sound_Selection_Audio_Works_by_Artists_1980.pdf","http://worldcat.org/oclc/8775250","Committee for the Visual Arts, New York, 1980",""
"18740","2017","Poetry, Film, Humor: Narratives of Exception in the Years of Autarky","","https://monoskop.org/log/?p=18740","art history, avant-garde, spain","https://monoskop.org/images/3/32/Poetry_Film_Humor_Narratives_of_Exception_in_the_Years_of_Autarky_2017.jpg","9788480265461","279","The years around World War, which was undoubtedly the most difficult phase of Franco’s dictatorship, also served as the back-drop for the development of a new avant-garde culture in Spain. Its birth is traditionally cited by art historians as taking place between 1947 and 1948, when groups such as Dau al Set in Barcelona and Pórtico in Zaragoza appeared or resumed their activities. The persistence, even today, of certain attitudes and poetics characteristic of that generation of artists as well as their extensive representation in the collection of the Museo Reina Sofía has made this period into one of the museum’s principal areas of research. As a result, it is essential for the museum to dig deeper in its analysis and critial (re)interpretation of this time.\n\nWith the restructuring and enlargement of the rooms devoted to this period, along with the present publication, the Museo Reina Sofía’s Collections Deaprtment seeks to significantly broaden the investigative scope traditionally applied to the visual culture of this period in Spain’s recent history.","","","Museo Nacional Centro de Arte Reina Sofía, Madrid, 2017",""
"18400","1971","In Another Moment","","https://monoskop.org/log/?p=18400","art, conceptual art","https://monoskop.org/images/d/d6/In_Another_Moment_1971.jpg","","","The exhibition _At Another Moment_ was conceptualized as curatorial translation of the temporary exhibition , organized in the entrance of an apartment house in Frankopanska 2A, Zagreb, into a more “permanent” exhibition, taking place within the (alternative) institutional space of the (SKC) in Belgrade.","https://monoskop.org/images/4/4d/In_Another_Moment_1971.pdf","http://worldcat.org/oclc/693950074","Studentski kulturni centar, Belgrade, Oct 1971",""
"18383","1962","Dylaby","","https://monoskop.org/log/?p=18383","art, installation art, kinetic art, pop art","https://monoskop.org/images/5/57/Dylaby_1962.jpg","","","artists gathered from several countries  \nwith the aim to let the public  \nparticipate in their work  \nto let you see, feel, cooperate with them\n\nthey start from daily life  \nthe sensations you get  \nfeeling your way through a labyrinth  \nthe surprise when you open a door  \nthe freshness of the coloured world of plastic  \nthe machine that moves  \nbut without practical purpose  \nthe shooting gallery where you don’t destroy  \nbut help to colour the objects …\n\nsix artists in seven rooms  \ncreated surroundings full of variety  \ngay and weird, loud and silent  \nwhere you may laugh, get excited  \nor thoughtful\n\nyou are not outside the objects  \nbut constantly within them  \nas part of the whole”  \n(catalogue introduction)\n\nA visitor to this exhibition “was to navigate a maze constructed by Daniel Spoerri, Per Olof Ultveldt, Niki de Saint Phalle, Jean Tinguely, Martial Raysse and Robert Rauschenberg. The labyrinth was made largely from scrap metal and spanned seven rooms of the Stedelijk Museum in Amsterdam. After feeling their way through Spoerri’s darkened maze, and weathering a number of wooden obstacles by Ultveldt, the participant ended up in a room where paintings ‘hung’ from the floor and marbles ‘stood’ on the walls.\n\nTo finish the trail, one had to splash around Raysse’s beach, fire a gun at Saint-Phalle’s shooting painting, turn right at Rauschenberg’s caged clocks and exit through Tinguely’s balloon-filled room. The terms ‘playground’ and ‘funfair’, frequently used by a rather sceptical press, were apt descriptions of what transpired in the museum galleries. Art as conceived in _Dylaby_ required active engagement on the part of the visitor. The exhibition followed in the wake of _Bewogen Beweging_ \[Art in Motion\] (1961), another Stedelijk Museum exhibition of interactive kinetic art, initiated by Tinguely the year before. The curatorial program was a response to the 1961 ‘a-dynamic manifesto’ of Dutch artists Ger van Elk and Wim T. Schippers, who berated the artistic pretentiousness of abstract expressionism that dominated museums.\n\nThe exhibition was a forebode of the ‘happenings’ that would take Amsterdam by storm from the mid-1960s. As the artwork now became a temporary experience that relied heavily on audience participation, its survival relied on photographic documentation. A legion of photographers orbited such cultural figures as Robert Jasper Grootveld and Theo Kley, choreographer Koert Stuyf and frequented the performance stronghold of Ferdi and Tajiri in Limburg.\n\nApart from the introductory text by Willem Sandberg, the _Dylaby_ catalogue almost exclusively consists of visuals. The double arrow on the cover, designed by Rauschenberg, was mounted on a car tire at the entrance of the labyrinth. Van der Elsken’s photographs reiterated the organised chaos of the exhibition. An image of disoriented visitors was rotated 90 degrees on the catalogue page, making them seem as though they were walking sideways on the gallery walls. Van der Elsken followed Tinguely around the Waterlooplein as he was scavenging for bicycle wheels and other metal scrap for his kinetic sculptures. A handwritten foldout in the catalogue features a timetable tracing the artists’ every move in the three weeks preceding the opening. After the show, the props landed in the garbage dump along with the rest of the labyrinth. What is left is an archive of bewildered press reviews; and this catalogue.","https://monoskop.org/images/8/8a/Dylaby_1962.pdf","http://worldcat.org/oclc/901085421","Stedelijk Museum, Amsterdam, 1962",""
"18381","2007","documenta 12","","https://monoskop.org/log/?p=18381","art, contemporary art, form, migration","https://monoskop.org/images/e/eb/Documenta_12_2007.jpg","9783836500524","415","For the first time in the history of the documenta, the major event in Kassel was organized under the direction of a couple: Roger M. Buergel as the designated art director and Ruth Noack as curator. They served only “unofficially” as a two-member directorial team, however, as the documenta statutes do not allow for the possibility of two co-directors. Together, they developed a clearly defined programmatic concept under the banner of “The Migration of Forms.” What that meant was that, over the course of human history, visual culture has had only a limited number of basic forms with which to work—forms that have been used in different contexts and with different conceptual focuses throughout the history of art. Buergel/Noack pointed out that “contemporary does not mean that the works originated yesterday. They must be meaningful for people today. Documenta 12 is concerned with both historical lines of development in art and unexpected concurrences.” In order to bring these “unexpected concurrences” to light, relationships were established between works of art from different decades and cultures in which similar formal patterns have emerged—a process that has led to a “migration” of aesthetic forms across temporal and cultural boundaries culminating in the art of our postmodern world. This formalism was emphasized in the Neue Galerie by walls painted different colors. In turn, this focus on the phenomenon of migration resulted in the selection of a high percentage of artists from Africa, Asia, and Eastern Europe. New to the program was the inclusion of old art, from fourteenthcentury Persian miniatures to global art from recent decades. Artists already long since recognized in their own homelands, such as Nasreen Mohamedi, for example, were not the only ones presented to a broad public in Germany for the first time. The works of several exemplary artists—John McCracken, Kerry James Marshall, Charlotte Poseneske, and Gerwald Rockenschaub—also migrated through all exhibition venues.","https://monoskop.org/images/4/40/Documenta_12_2007.pdf","http://worldcat.org/oclc/145453216","Taschen, Cologne, 2007",""
"18363","1995","Chris Marker: Silent Movie","Ann Bremner","https://monoskop.org/log/?p=18363","cinema, film, film history, silent cinema, silent film","https://monoskop.org/images/3/33/Marker_Chris_Silent_Movie_1995.jpg","","40","Marker employs five-channels of video, each a thematic exploration of early cinema. Film images disclosing ‘The Journey,’ ‘The Face,’ ‘The Gesture,’ and ‘The Waltz’ occupy four of the monitors while on the fifth (and middle) monitor is a collection of ninety-four silent-era intertitles, ‘telling short, mysterious pieces of unknown stories.’ These moving images travel through a computer interface that assembles an ever-changing array of sequences. At any given moment, each passage is in unique juxtaposition with the other images passing across the surrounding monitors. Coloration, tone, and association are governed by chance contiguities; even the intertitles narrate across a field of fluid relationships.”\n\n“_Silent Movie_. To give an installation the name of something that never existed is probably less innocent than the average cat may infer. There was never anything like silent cinema, except at the very beginning, or in film libraries, or when the pianist had caught a bad flu. There was at least a pianist, and soon an orchestra, next the Wurlitzer, and what contraptions did they use, in the day of my childhood, to play regularly the same tunes to accompany the same film? I’m probably one of the last earthlings–the ‘last,’ says the cat–to remember what themes came with what films: ‘A Midsummer Night’s Dream’ on Wings (the dogfights), Liszt’s ‘The Preludes’ on Ben Hur. A touch of humour noir here, to think that the saga of the young hebrew prince was adorned by Hitler’s favorite music, which in turn explains why you hear it more often than Wagner on the German war newsreels–but I get carried away. …","https://monoskop.org/images/e/ea/Marker_Chris_Silent_Movie_1995.pdf","http://worldcat.org/oclc/32457681","Wexner Center for the Arts, Ohio State University, Columbus/OH, 1995",""
