"id","year","title","editor","url","tags","cover","isbn","numberOfPages","description","pdf","worldcat","publisher","exhibition"
"10155","1995","Articulated Light: The Emergence of Abstract Film in America","Gerald O’Grady, Bruce Posner","https://monoskop.org/log/?p=10155","abstract cinema, avant-garde, experimental film, film, film history, united states","https://monoskop.org/images/8/86/OGrady_Gerald_Posner_Bruce_eds_Articulated_Light_The_Emergence_of_Abstract_Film_in_America.jpg","","16","the most comprehensive retrospective of abstract films ever mounted","https://monoskop.org/images/d/d2/OGrady_Gerald_Posner_Bruce_eds_Articulated_Light_The_Emergence_of_Abstract_Film_in_America.pdf","","Harvard Film Archive, Cambridge, MA, and Anthology Film Archives, New York, 1995",""
"10154","1979","Film as Film: Formal Experiment in Film, 1910-1975","","https://monoskop.org/log/?p=10154","abstract cinema, avant-garde, experimental film, film, film history","https://monoskop.org/images/thumb/c/c3/Film_as_Film_Formal_Experiment_in_Film_1910-1975.jpg/535px-Film_as_Film_Formal_Experiment_in_Film_1910-1975.jpg","","152","","https://monoskop.org/images/3/36/Film_as_Film_Formal_Experiment_in_Film_1910-1975.pdf","","Arts Council of Great Britain, London, 1979",""
"10146","2013","Mutually: Communities of the 1970s and 1980s / Navzájem: Společenství 70. a 80. let, catalogue","","https://monoskop.org/log/?p=10146","1970s, 1980s, archive, art, art history, counterculture, czechoslovakia, film, hungary, participation, photography, video","https://monoskop.org/images/0/08/Mutually_Communities_of_the_1970s_and_1980s_p34.jpg","","44","unofficial culture","https://monoskop.org/images/4/4c/Mutually_Communities_of_the_1970s_and_1980s_catalogue.pdf","","tranzitdisplay, Prague, and The House of Arts, Brno, 2013",""
"10105","1927","Machine-Age Exposition, catalogue","","https://monoskop.org/log/?p=10105","architecture, art, avant-garde, constructivism, cubism, design, industrial design, machine","https://monoskop.org/images/d/de/Machine-Age_Exposition_catalogue.jpg","","44","architecture, engineering, industrial arts and modern art.”\n\nThe exhibition was initiated by Jane Heap of _The Little Review_, a New York literary magazine, and organised along with Société des urbanistes, Brussels; U.S.S.R. Society of Cultural Relations with Foreign Countries; Kunstgewerbeschule, Vienna; Czlonkowie Group _Praesens_, Warsaw; Architects D.P.L.G, Paris; and Advisory American Section.\n\nThe volume contains a panorama of European and American architecture and art, with photo documentation, and following articles: “Foreword: Architecture of this Age” by Hugh Ferriss, “The Aesthetic of the Machine and Mechanical Introspection in Art” by Enrico Prampolini, “Machine and Art” by Alexander Archipenko, “The Americanization of Art” by Louis Lozowick, “French Architecture” by André Lurçat, “Architecture Opens Up Volume” by Szymon Syrkus, “Machine-Age Exposition” by Jane Heap, “The Poetry of Forces” by Mark Turbyfill, and “Modern Glass Construction” by Frederick L. Keppler.\n\nThe artists committee of the exhibition included Alexander Archipenko, Robert Chanler, Andrew Dasberg, Charles Demuth, Muriel Draper, Marcel Duchamp, Josef Frank, Hugh Ferriss, Louis Lozowick, André Lurçat, Elie Nadleman, Man Ray, Boardman Robinson, Charles Sheeler, Ralph Steiner, Szymon Syrkus and L. Van der Swallmen.\n\nRepresented countries: “America”, Austria, Belgium, France, Germany, Poland and Russia.\n\nPublished in New York, 1927  \n44 pages  \nvia\n\n(E. B. White, The New Yorker, 1927): “That the machine is the tutelary symbol of the universal dynamism can be discovered at the Machine Age Exposition. \[…\] Drawings, photographs, cubist and constructionist figures by reputable modern artists are side by side with cogs, motor boat propellers, Crane valves, insides of pianos and diving suits.","https://monoskop.org/images/3/30/Machine-Age_Exposition_catalogue.pdf","","",""
"9962","2012","You Killed Me First: The Cinema of Transgression","Susanne Pfeffer","https://monoskop.org/log/?p=9962","1980s, art, cinema, experimental film, film, horror, humour, sex, violence","https://monoskop.org/images/thumb/c/c0/You_Killed_Me_First_The_Cinema_of_Transgression.jpg/413px-You_Killed_Me_First_The_Cinema_of_Transgression.jpg","","176","Basically, in one sentence, give us the definition of the ‘Cinema of Transgression’.” Nick Zedd: “Fuck you.","https://app.koofr.net/content/links/5ef04049-04f6-4e67-b249-d7d2a8bd05f1/files/get/You%20Killed%20Me%20First.%20The%20Cinema%20of%20Transgression%20(no%20OCR).pdf?path=&force","","KW Institute of Contemporary Art, Berlin, and Walther Koenig, Cologne, 2012","http://www.kw-berlin.de/de/exhibitions/you_killed_me_first_55"
"9848","1977","an <i>anti</i>-catalogue","","https://monoskop.org/log/?p=9848","activism, art, politics","https://monoskop.org/images/f/f0/Anti-Catalog_.jpg","","80","_An Anti-Catalog_ was the work of the Catalog Committee of the group Artists Meeting for Cultural Change (AMCC). A landmark publication of the 1970s, its purpose was to protest the Whitney Museum of American Art’s bicentennial exhibition, which was titled _Three Centuries of American Art_. The Whitney show featured John D. Rockefeller III’s collection of mainly eighteenth and nineteenth-century American art–a collection that featured only one African American and one woman artist.\n\nThe Catalog Committee, which consisted of fifteen artists and two art historians, spent almost a year producing an eighty-page book containing articles and documents. Originally conceived as a critique of art historian E.P. Richardson’s catalog for the Whitney exhibition, the committee evolved ideas for pictorial essays that would encompass native American art, African-American art, art by women, critiques of pervasive class bias in the art world, and critical examinations of cultural institutions. As the committee wrote in its description of its project, ‘we share the belief that culture should no longer exist merely as an extension of the economic interests or the personal ‘tastes’ of the wealthy and powerful. Nor can we hope to transform culture outside of a struggle to transform the society from which it springs.’ Strong words that have lost little of their relevance for today’s cultural scene.","https://monoskop.org/images/f/fc/An_Anti-Catalog.pdf","","Artists Meeting for Cultural Change, New York, 1977",""
"9616","1972","Laxmi P. Sihare (ed.): Computer Art, catalogue","","https://monoskop.org/log/?p=9616","art, computer art, computing","https://monoskop.org/images/8/82/Sihare_Laxmi_P_ed_Computer_Art_catalogue_1972.jpg","","57","","https://monoskop.org/images/d/dc/Sihare_Laxmi_P_ed_Computer_Art_catalogue_1972.pdf","","",""
"9251","2013","Hold stenhårdt fast på greia di: Norwegian Art and Feminism 1968-89, catalogue","","https://monoskop.org/log/?p=9251","1960s, 1970s, 1980s, activism, art, feminism, norway","https://monoskop.org/images/c/c1/Hold_stenhardt_fast_pa_greia_di_Norwegian_Art_and_Feminism_1968-89.jpg","","32","Hold on to your thing”, but the original title holds more references) is the first major exhibition to consider the connections between artistic practice and the feminist movement in Norway.\n\n“The exhibition presents an overview of the many ways in which second-wave feminist ideas contributed to a transformation of the accepted subjects and methods of contemporary art in Norway, as well as the creative contribution that artists made to the public representation of the women’s movement. From the formal liberations of the 60s avant-garde, through the developing political awareness and organised struggles of the 70s, to the disenchantment of the 80s, the exhibition also aims to show some of the ways in which formal art production was influenced by a radical core of activist practice.","http://www.kunsthalloslo.no/wordpress/wp-content/uploads/2013/03/hold-stenhaardt-fast.pdf","","Kunsthall, Oslo, 2013",""
"18213","2006","Undercover Surrealism: Georges Bataille and DOCUMENTS","Dawn Ades, Simon Baker","https://monoskop.org/log/?p=18213","1920s, 1930s, archaeology, art, art history, avant-garde, ethnography, film, painting, photography, sculpture, surrealism","http://images.amazon.com/images/P/1853322504.01.LZZZZZZZ.jpg","","272","In the Paris art world of the 1920s, Georges Bataille and his journal _DOCUMENTS_ represented a dissident branch of surrealism. Bataille—poet, philosopher, writer, and self-styled “enemy within” surrealism—used _DOCUMENTS_ to put art into violent confrontation with popular culture, ethnography, film, and archaeology. _Undercover Surrealism_, taking the visual richness of _DOCUMENTS_ as its starting point, recovers the explosive and vital intellectual context of works by Picasso, Dalí, Miró, Giacometti, and others in 1920s Paris. Featuring 180 color images and translations of original texts from _DOCUMENTS_ accompanied by essays and shorter descriptive texts, _Undercover Surrealism_ recreates and recontextualizes Bataille’s still unsettling approach to culture. Putting Picasso’s _Three Dancers_ back into its original context of sex, sacrifice, and violence, for example, then juxtaposing it with images of gang wars, tribal masks, voodoo ritual, Hollywood musicals, and jazz, makes the urgency and excitement of Bataille’s radical ideas startlingly vivid to a twenty-first-century reader.","https://hostb.org/T05/Ades,%20Dawn;%20Baker,%20Simon%20(eds.)%20-%20Undercover%20Surrealism.%20Georges%20Bataille%20and%20Documents.pdf","","",""
"8934","2012","Pop Politics: Activisms at 33 Revolutions, catalogue","","https://monoskop.org/log/?p=8934","activism, art, music, politics, popular culture, sound","https://monoskop.org/images/6/60/Pop_Politics_Activisms_at_33_Revolutions.jpg","9788445134481","304","The point of departure for _Pop Politics_ is that the political agenda of the visual arts has in many occasions inherited and expanded the experiences of music. The exhibition shows how many artists and art theorists have from their own personal practice visited music, whether as makers, consumers, or critical agents. The exhibition is situated on the margins of the formal consideration of politics, that which refers to forms of government and processes of representation, the taking of decisions and their administration.","https://monoskop.org/images/b/b6/Pop_Politics_Activisms_at_33_Revolutions.pdf","","CA2M Centro de Arte Dos de Mayo, Madrid, 2012",""
"8726","2011","The Edge of Reason, catalogue","","https://monoskop.org/log/?p=8726","art, irrational, mysticism, occultism, rationalism, science","https://monoskop.org/images/5/5a/The_Edge_of_Reason_catalogue.jpg","","56","","http://www.sidselchristensen.com/files/Catalogue_The_Edge_of_Reason.pdf","","KinoKino Centre for Art and Film, Sandnes, Norway, 2011",""
"8567","2003","A&F Quarterly: Back to School: The Sex Ed Issue","","https://monoskop.org/log/?p=8567","advertising, lifestyle, philosophy, psychoanalysis","https://monoskop.org/images/8/88/A_and_F_Quarterly_Back_to_School_2003_The_Sex_Ed_Issue.jpg","","126","","https://monoskop.org/images/d/db/A_and_F_Quarterly_Back_to_School_2003_The_Sex_Ed_Issue.pdf","","Abercrombie & Fitch, New Albany/OH",""
"8265","2006","Olga Goriunova (ed.): Readme 100: Temporary Software Art Factory","","https://monoskop.org/log/?p=8265","art, market, software, software art, software studies","http://images.amazon.com/images/P/3833443693.01.LZZZZZZZ.jpg","","168","This book discusses projects and research completed in the framework of the _Readme 100 Temporary Software Art Factory_, which took place in Dortmund in November 2005 and was co-organized by Hartware MedienKunstVerein.\n\nIt deals with the topic of production as it relates to software, software art and software cultures. Thus, it focuses not only on software as a product itself, but also on the experiment of its production through methods including outsourcing, use of open source solutions and self-production. Topics addressed include economies of arts, desire and openness, harmony of markets, the unmarketable, reverse outsourcing, resistant mapping and others.\n\nThe result is a multi-faceted collection of project descriptions, illustrations, research texts and features relating to the theme of software art production.","https://monoskop.org/images/f/f2/Goriunova_Olga_ed_Readme_100_Temporary_Software_Art_Factory.pdf","","Hartware MedienKunstVerein, Dortmund, 2006",""
"7810","1953","Ben F. Laposky: Electronic Abstractions: A New Approach to Design","","https://monoskop.org/log/?p=7810","abstract art, electronic art, photography, television","https://monoskop.org/images/e/e7/Laposky_Ben_F_Electronic_Abstractions_A_New_Approach_to_Design.jpg","","16","In 1950 American draftsman, graphic artist and mathematician Benjamin F. Laposky of Cherokee, Iowa, first used a cathode ray oscilloscope with sine wave generators and various other electrical and electronic circuits to create abstract art, which he called ‘electrical compositions’. The electrical vibrations shown on the screen of the oscilloscope, which included Lissajous figures, he recorded by still photography. Some of Laposky’s images were published in _Scripta Mathematica_ in 1952.\n\nIn 1953 Laposky exhibited fifty images that called ‘Oscillons’ (or oscillogram designs) at the Sanford Museum in Cherokee, Iowa. To record this exhibition Laposky published an exhibition catalogue entitled _electronic abstractions_. Because of this exhibition Laposky is credited as the earliest pioneer in electronic art, more specifically in the analog vector medium. In later work Laposky also incorporated motorized rotating filters of variable speed to color the patterns. He never programmed computers to create images.\n\nA version of Laposky’s electronic abstractions show was exhibited across the United States, in France at LeMons, and other places by the Cultural Relations Section of the United States from 1953 to 1961.","https://monoskop.org/images/3/35/Laposky_Ben_F_Electronic_Abstractions_A_New_Approach_to_Design.pdf","","",""
"7746","1972","Eadweard Muybridge: The Stanford Years 1872–82","Anita Ventura Mozley","https://monoskop.org/log/?p=7746","chronophotography, cinema, film, film history, movement, photography","https://monoskop.org/images/b/b2/Muybridge_Eadweard_The_Stanford_Years_1872-1882.jpg","","136","","https://monoskop.org/images/3/31/Muybridge_Eadweard_The_Stanford_Years_1872-1882.pdf","","",""
"7684","1994","Josef Albers: Glass, Color, and Light","","https://monoskop.org/log/?p=7684","architecture, art, colour, glass, light art","https://monoskop.org/images/4/4d/Albers_Josef_Glass_Color_and_Light.jpg","","152","","https://monoskop.org/images/4/4c/Albers_Josef_Glass_Color_and_Light.pdf","","Guggenheim Museum Publications, New York, 1994",""
"7658","1996","Mediascape, catalogue","","https://monoskop.org/log/?p=7658","art, electronic art, media art, technology, video, video art","https://monoskop.org/images/4/4a/Mediascape.jpg","","68","","https://monoskop.org/images/c/c4/Mediascape.pdf","","Guggenheim Museum Publications, New York; with ZKM, Karlsruhe, 1996",""
"7639","2000","Gary Garrels (ed.): Sol LeWitt: A Retrospective","","https://monoskop.org/log/?p=7639","art, conceptual art, minimal art","http://images.amazon.com/images/P/0300083580.01.LZZZZZZZ.jpg","","416",", one of the most important American artists of this century, has spent the past four decades creating artworks that explore the potential of ideas for the making of visual forms. LeWitt transforms these ideas into objects of exquisite beauty and elegance, deliberately introducing elements of chance, intuition, or irrationality into the systems that govern the creation of his works. LeWitt’s delicate balancing act between thought and form, between order and disorder, between authorship and anonymity, has exerted an enormous influence on artists of subsequent generations. This book, the first retrospective of LeWitt’s work in more than twenty years, fosters a deeper understanding of the artist’s career and its significance to American art and thought.\n\nIncluding essays by Gary Garrels, Martin Friedman, Andrea Miller-Keller, Brenda Richardson, Anne Rorimer, John S. Weber, and Adam D. Weinberg, the book charts the evolution of LeWitt’s art from his groundbreaking work in Conceptualism during the early 1960s through his turn toward a more lyrical and sensual form of abstraction around 1980. With more than 350 images, the book provides a stunning visual survey of LeWitt’s oeuvre from 1960 to the present, including sumptuous wall drawings, three-dimensional structures, and works on paper.","https://monoskop.org/images/1/15/Garrels_Gary_ed_Sol_LeWitt_A_Retrospective.pdf","","",""
"7630","2002","Allan Sekula: Fish Story (1995/2002)","","https://monoskop.org/log/?p=7630","capitalism, photography","https://monoskop.org/images/8/85/Sekula_Allan_Fish_Story.jpg","","206","_The Fish Story_ project focuses on the quest for centers of maritime power past and present and the political interest in the change in the economic infrastructure of industrial ports yielded by late-capitalist rule in its phase of multinational and global expansion. This is the third project of the American photographer and historian Allan Sekula (b. 1951) in his cycle on the imaginary and real geography of the advanced capitalist world.\n\nWorking on the assumption that photography remains inevitably tied to ideological and real historical factors, Allan Sekula is continuing the tradition of critical realism. However, far from confining himself to illuminating the subject solely with photographic means, Sekula has been integrating the written word in his creative work since the Seventies. Consequently, Fish Story has been conceived from the outset as a book and as an exhibition. The photographs shown in this publication illustrate working conditions on highly industrialized container ships and in ports, while the texts yield insights masked by the visual, photographic information. The resultant montage of images and texts encourages dialogue with the viewer.","https://monoskop.org/images/8/86/Sekula_Allan_Fish_Story.pdf","","Richter, Düsseldorf, 1995",""
"7261","2004","The Interventionists: Users’ Manual for the Creative Disruption of Everyday Life","Nato Thompson, Gregory Sholette","https://monoskop.org/log/?p=7261","activism, art, cyberfeminism, education, participation, political art, politics, situationists, tactical media","https://monoskop.org/images/9/92/Thompson_Nato_Sholette_Gregory_eds_The_Interventionists.jpg","","154","Art made to attach to buildings or to be given away? Wearable art for street demonstrations or art that sets up a booth at a trade show? This is the art of the interventionists, who trespass into the everyday world to raise our awareness of injustice and other social problems. These artists don’t preach or proselytize; they give us the tools to form our own opinions and create our own political actions. _The Interventionists_, which accompanies an exhibit at MASS MoCA, serves as a handbook to this new and varied work. It’s a user’s guide to art that is exciting, provocative, unexpected, inspiring (artistically and politically), and fun. From Michael Rakowitz’s inflatable homeless shelter and William Pope.L’s “Black Factory” truck with pulverizer, gift shop, and giant inflatable igloo to the Biotic Baking Brigade’s political pie-throwing, the art of _The Interventionists_ surveys a growing genre and offers a guide for radical social action.\n\nThe book classifies the artists according to their choice of tactics: the Nomads, who create mobile projects; Reclaim the Streets, artists who act in public places; Tools for Resistance: Ready to Wear, artists who produce fashion for political action; and the Experimental University, artists whose work engages pedagogy and theory. The accompanying text includes essays by noted scholars putting the work in a broader cultural and social context as well as texts by the artists themselves.","https://monoskop.org/images/9/9e/Thompson_Nato_Sholette_Gregory_eds_The_Interventionists_Users_Manual_for_the_Creative_Disruption_of_Everyday_Life_2004.pdf","","",""
"7213","1995","Constructivism and Kinetic Art: Exat 51, New Tendencies, catalogue","","https://monoskop.org/log/?p=7213","1950s, 1960s, 1970s, art, computing, constructivism, cybernetics, graphic design, information theory, kinetic art","https://monoskop.org/images/5/5a/Constructivism_and_Kinetic_Art_Exat_51_New_Tendencies_catalogue.jpg","","154","","https://monoskop.org/images/e/e1/Constructivism_and_Kinetic_Art_Exat_51_New_Tendencies_catalogue.pdf","","City Gallery, Zagreb, June 1995",""
"7207","1975","Allan Kaprow: Comfort Zones","","https://monoskop.org/log/?p=7207","art, performance art","https://monoskop.org/images/8/8b/Kaprow_Allan_Comfort_Zones.jpg","","28","territorial bubbles” and “eye contacts","https://monoskop.org/images/a/ac/Kaprow_Allan_Comfort_Zones.pdf","","",""
"6843","1993","Nahui Olin: una mujer de los tiempos modernos, 2nd ed","","https://monoskop.org/log/?p=6843","activism, art, art history, literature, mexico, painting, poetry","https://monoskop.org/images/b/bd/Nahui_Olin.jpg","","173","","https://monoskop.org/images/3/32/Olin_Nahui_Una_mujer_de_los_tiempos_modernos_2nd_ed.pdf","","",""
"6769","1965","František Kalivoda (ed.): Výstava László Moholy-Nagy, Brno, catalogue","","https://monoskop.org/log/?p=6769","art, constructivism, photogram, photography","https://monoskop.org/images/3/30/Kalivoda_Frantisek_ed_Vystava_Laszlo_Moholy-Nagy_Brno_1965_catalogue.jpg","","24","","https://monoskop.org/images/9/99/Kalivoda_Frantisek_ed_Vystava_Laszlo_Moholy-Nagy_Brno_1965_catalogue.pdf","","The House of Arts, Brno, October 1965",""
"6713","2009","Juan Carlos Romero: Cartografías del cuerpo, asperezas de la palabra, catalogue","","https://monoskop.org/log/?p=6713","activism, argentina, art, political art, politics","https://monoskop.org/images/7/74/Romero_Juan_Carlos_Cartografias_del_cuerpo_catalogue.jpg","","64","La producción de Juan Carlos Romero se inscribe en zonas de intervención diversas y superpuestas: grabador y performer, poeta visual y artista-correo, editor de revistas experimentales y otras publicaciones autogestionadas, archivista y organizador de exposiciones, artista grupal, docente y militante. Desde posicionamientos múltiples y simultáneos, Romero trama un complejo dispositivo crítico cuyo irregular despliegue desarma la integración retrospectiva de su obra en un relato coherente y unitario.\n\nEn las estrategias poético-políticas que activa, la producción de Romero cruza diferentes problemáticas. La puesta en cuestión del grabado en sus fundamentos conceptuales y técnicos y la opción de la imagen múltiple como dispositivo político en la transformación de los modos de vida. La intervención en espacios alternativos a los circuitos artísticos institucionales y la búsqueda de una mayor participación del espectador. Las interferencias mutuas entre grabado artístico, imagen mediática y gráfica popular. La palabra como registro opaco, abierto a turbulencias de la significación que desorganizan los pactos de sentido hegemónicos fijados por la “transparencia” neoliberal. La incorporación del cuerpo como territorio de inscripción de las relaciones (conflictivas) de poder que reglamentan el orden individual y social.\n\n_La exposición 1. Juan Carlos Romero. Cartografías del cuerpo, asperezas de la palabra_ interpela estos problemas en un conjunto de obras que abarca más de cuarenta años (1966-2009) de la producción del artista. Cuerpo y palabra constituyen las dos dimensiones que la exposición tensiona en los trayectos cruzados que diagrama al interrogar la densidad conflictual de esta serie de obras. Desde esta perspectiva, no se trata de presentar un recorrido exhaustivo y acabado de la obra de Romero. En el recorte conscientemente parcial que propone como apuesta interpretativa, esta muestra no pretende fijar un relato, sino, por el contrario, hacer explícitas las tensiones y derivas, las fricciones e interferencias que dicho cuerpo de producción activa en la potencia crítica de sus accidentes y porosidades, para, lejos de clausurar su espesor disruptivo en la “llamada al orden” de su ordenamiento retrospectivo, abrirlo a los desfases e intermitencias de sentido que lo animan.\n\nEn este marco, la exposición busca incidir críticamente en otros dos debates. Por un lado, el referido a las problemáticas relaciones entre práctica artística y política. En una dirección que se aparta de su reducción como ámbitos mutuamente excluyentes –solo conciliables en tanto hay un afuera-del-arte que reclama su “politización”-, esta muestra propone pensar la relación arte / política en el territorio movedizo en el que ambas dimensiones se interpelan de manera recíproca.","https://monoskop.org/images/d/dd/Romero_Juan_Carlos_Cartografias_del_cuerpo_asperezas_de_la_palabra_catalogue.pdf","","Espacio de Arte Fundacion OSDE, Buenos Aires, 2009",""
"6711","1970","Arte y Cibernética, catalogue","","https://monoskop.org/log/?p=6711","argentina, art, computer art, cybernetics, south america","https://monoskop.org/images/2/29/Arte_y_Cibernetica_catalogue.jpg","","","","https://monoskop.org/images/7/79/Arte_y_Cibernetica_catalogue.pdf","","Centro de Arte y Comunicacion (CAC), Buenos Aires, June 1970",""
"6706","2012","A Blind Love, catalogue","","https://monoskop.org/log/?p=6706","art, film, photography","https://monoskop.org/images/3/33/A_Blind_Love.jpg","","64","","https://monoskop.org/images/b/b7/A_Blind_Love_catalogue.pdf","","Polansky Gallery / MKNKLL, Prague, October 2012",""
